{
  "version": "0.1.0",
  "map": {
    "width": 64,
    "height": 64,
    "tile_width": 32,
    "tile_height": 32,
    "orientation": "orthogonal"
  },
  "tileset": {
    "id": "default_rpg_32",
    "image": "tilesets/default_rpg_32.png",
    "tile_width": 32,
    "tile_height": 32,
    "columns": 16,
    "tile_count": 32
  },
  "layers": {
    "terrain": [
      8,
      8,
      8,
      8,
      8,
      8,
      8,
      8,
      8,
      8,
      8,
      8,
      8,
      8,
      8,
      8,
      8,
      8,
      8,
      8,
      8,
      8,
      8,
      8,
      8,
      8,
      8,
      8,
      8,
      8,
      8,
      8,
      8,
      8,
      8,
      8,
      8,
      8,
      8,
      8,
      8,
      8,
      8,
      8,
      8,
      8,
      8,
      8,
      8,
      8,
      8,
      8,
      8,
      8,
      8,
      8,
      8,
      8,
      8,
      8,
      8,
      8,
      8,
      8,
      8,
      8,
      8,
      8,
      8,
      8,
      8,
      8,
      8,
      8,
      8,
      8,
      8,
      8,
      8,
      8,
      8,
      8,
      8,
      8,
      8,
      8,
      8,
      8,
      8,
      8,
      8,
      8,
      8,
      8,
      8,
      8,
      8,
      8,
      8,
      8,
      8,
      8,
      8,
      8,
      8,
      8,
      8,
      8,
      8,
      8,
      8,
      8,
      8,
      8,
      8,
      8,
      8,
      8,
      8,
      8,
      8,
      8,
      8,
      8,
      8,
      8,
      8,
      8,
      8,
      8,
      8,
      8,
      8,
      8,
      8,
      8,
      8,
      8,
      8,
      8,
      8,
      8,
      8,
      8,
      8,
      8,
      8,
      8,
      8,
      8,
      8,
      8,
      8,
      8,
      8,
      8,
      8,
      8,
      8,
      8,
      8,
      8,
      8,
      8,
      8,
      8,
      8,
      8,
      8,
      8,
      8,
      8,
      8,
      8,
      8,
      8,
      8,
      8,
      8,
      8,
      8,
      8,
      8,
      8,
      8,
      8,
      8,
      8,
      8,
      8,
      8,
      8,
      8,
      8,
      8,
      8,
      8,
      8,
      8,
      8,
      8,
      8,
      8,
      8,
      8,
      8,
      8,
      8,
      8,
      8,
      8,
      8,
      8,
      8,
      8,
      8,
      8,
      8,
      8,
      8,
      8,
      8,
      8,
      8,
      8,
      8,
      8,
      8,
      8,
      8,
      8,
      8,
      8,
      8,
      8,
      8,
      8,
      8,
      8,
      8,
      8,
      8,
      8,
      8,
      8,
      8,
      8,
      8,
      8,
      8,
      8,
      8,
      8,
      8,
      8,
      8,
      8,
      8,
      8,
      8,
      8,
      8,
      8,
      8,
      8,
      8,
      8,
      8,
      8,
      8,
      8,
      8,
      8,
      8,
      8,
      8,
      8,
      8,
      8,
      8,
      8,
      8,
      8,
      8,
      8,
      8,
      8,
      8,
      8,
      8,
      8,
      8,
      8,
      8,
      8,
      8,
      8,
      8,
      8,
      8,
      8,
      8,
      8,
      8,
      8,
      8,
      8,
      8,
      8,
      8,
      8,
      8,
      8,
      8,
      8,
      8,
      8,
      8,
      8,
      8,
      8,
      8,
      8,
      8,
      8,
      8,
      8,
      8,
      8,
      8,
      8,
      8,
      8,
      8,
      8,
      8,
      8,
      8,
      8,
      8,
      8,
      8,
      8,
      8,
      8,
      8,
      8,
      8,
      8,
      8,
      8,
      8,
      8,
      8,
      8,
      8,
      8,
      8,
      8,
      8,
      8,
      8,
      8,
      8,
      8,
      8,
      8,
      8,
      8,
      8,
      8,
      8,
      8,
      8,
      8,
      8,
      8,
      8,
      8,
      8,
      8,
      8,
      8,
      8,
      8,
      8,
      8,
      8,
      8,
      8,
      8,
      8,
      8,
      8,
      8,
      8,
      8,
      8,
      8,
      8,
      8,
      8,
      8,
      8,
      8,
      8,
      8,
      8,
      8,
      8,
      8,
      8,
      8,
      8,
      8,
      8,
      8,
      8,
      8,
      8,
      8,
      8,
      8,
      8,
      8,
      8,
      8,
      8,
      8,
      8,
      8,
      8,
      8,
      8,
      8,
      8,
      8,
      8,
      8,
      8,
      8,
      8,
      8,
      8,
      8,
      8,
      8,
      8,
      8,
      8,
      8,
      8,
      8,
      8,
      8,
      8,
      8,
      8,
      8,
      8,
      8,
      8,
      8,
      8,
      8,
      8,
      8,
      8,
      8,
      8,
      8,
      8,
      8,
      8,
      8,
      8,
      8,
      8,
      8,
      8,
      8,
      8,
      8,
      8,
      8,
      8,
      8,
      8,
      8,
      8,
      8,
      8,
      8,
      8,
      8,
      8,
      8,
      8,
      8,
      8,
      8,
      8,
      8,
      8,
      8,
      8,
      8,
      8,
      8,
      8,
      8,
      8,
      8,
      8,
      8,
      8,
      8,
      8,
      8,
      8,
      8,
      8,
      8,
      8,
      8,
      8,
      8,
      8,
      8,
      8,
      8,
      8,
      8,
      8,
      8,
      8,
      8,
      8,
      8,
      8,
      8,
      8,
      8,
      8,
      8,
      8,
      8,
      8,
      8,
      8,
      8,
      8,
      8,
      8,
      8,
      8,
      8,
      8,
      8,
      8,
      8,
      8,
      8,
      8,
      8,
      8,
      8,
      8,
      8,
      8,
      8,
      8,
      8,
      8,
      8,
      8,
      8,
      8,
      8,
      8,
      8,
      8,
      8,
      8,
      8,
      8,
      8,
      8,
      8,
      8,
      8,
      8,
      8,
      8,
      8,
      8,
      8,
      8,
      8,
      8,
      8,
      8,
      8,
      8,
      8,
      8,
      8,
      8,
      8,
      8,
      8,
      8,
      8,
      8,
      8,
      8,
      8,
      8,
      8,
      8,
      8,
      8,
      8,
      8,
      8,
      8,
      8,
      8,
      8,
      8,
      8,
      8,
      8,
      8,
      8,
      8,
      8,
      8,
      8,
      8,
      8,
      8,
      8,
      8,
      8,
      8,
      8,
      8,
      8,
      8,
      8,
      8,
      8,
      8,
      8,
      8,
      8,
      8,
      8,
      8,
      8,
      8,
      8,
      8,
      8,
      8,
      8,
      8,
      8,
      8,
      8,
      8,
      8,
      8,
      8,
      8,
      8,
      8,
      8,
      8,
      8,
      8,
      8,
      8,
      8,
      8,
      8,
      8,
      8,
      8,
      8,
      8,
      8,
      8,
      8,
      8,
      8,
      8,
      8,
      8,
      8,
      8,
      8,
      8,
      8,
      8,
      8,
      8,
      8,
      8,
      8,
      8,
      8,
      8,
      8,
      8,
      8,
      8,
      8,
      8,
      8,
      8,
      8,
      8,
      8,
      8,
      8,
      8,
      8,
      8,
      8,
      8,
      8,
      8,
      8,
      8,
      8,
      8,
      8,
      8,
      8,
      8,
      8,
      8,
      8,
      8,
      8,
      8,
      8,
      8,
      8,
      8,
      8,
      8,
      8,
      8,
      8,
      8,
      8,
      8,
      8,
      8,
      8,
      8,
      8,
      8,
      8,
      8,
      8,
      8,
      8,
      8,
      8,
      8,
      8,
      8,
      8,
      8,
      8,
      8,
      8,
      8,
      8,
      8,
      8,
      8,
      8,
      8,
      8,
      8,
      8,
      8,
      8,
      8,
      8,
      8,
      8,
      8,
      8,
      8,
      8,
      8,
      8,
      8,
      8,
      8,
      8,
      8,
      8,
      8,
      8,
      8,
      8,
      8,
      8,
      8,
      8,
      8,
      8,
      8,
      8,
      8,
      8,
      8,
      8,
      8,
      8,
      8,
      8,
      8,
      8,
      8,
      8,
      8,
      8,
      8,
      8,
      8,
      8,
      8,
      8,
      8,
      8,
      8,
      8,
      8,
      8,
      8,
      8,
      8,
      8,
      8,
      8,
      8,
      8,
      8,
      8,
      8,
      8,
      8,
      8,
      8,
      8,
      8,
      8,
      8,
      8,
      8,
      8,
      8,
      8,
      8,
      8,
      8,
      8,
      8,
      8,
      8,
      8,
      8,
      8,
      8,
      8,
      8,
      8,
      8,
      8,
      8,
      8,
      8,
      8,
      8,
      8,
      8,
      8,
      8,
      8,
      8,
      8,
      8,
      8,
      8,
      8,
      8,
      8,
      8,
      8,
      8,
      8,
      8,
      8,
      8,
      8,
      8,
      8,
      8,
      8,
      8,
      8,
      8,
      8,
      8,
      8,
      8,
      8,
      8,
      8,
      8,
      8,
      8,
      8,
      8,
      8,
      8,
      8,
      8,
      8,
      8,
      8,
      8,
      8,
      8,
      8,
      8,
      8,
      8,
      8,
      8,
      8,
      8,
      8,
      8,
      8,
      8,
      8,
      8,
      8,
      8,
      8,
      8,
      8,
      8,
      8,
      8,
      8,
      8,
      8,
      8,
      8,
      8,
      8,
      8,
      8,
      8,
      8,
      8,
      8,
      8,
      8,
      8,
      8,
      8,
      8,
      8,
      8,
      8,
      8,
      8,
      8,
      8,
      8,
      8,
      8,
      8,
      8,
      8,
      8,
      8,
      8,
      8,
      8,
      8,
      8,
      8,
      8,
      8,
      8,
      8,
      8,
      8,
      8,
      8,
      8,
      8,
      8,
      8,
      8,
      8,
      8,
      8,
      8,
      8,
      8,
      8,
      8,
      8,
      8,
      8,
      8,
      8,
      8,
      8,
      8,
      8,
      8,
      8,
      8,
      8,
      8,
      8,
      8,
      8,
      8,
      8,
      8,
      8,
      8,
      8,
      8,
      8,
      8,
      8,
      8,
      8,
      8,
      8,
      8,
      8,
      8,
      8,
      8,
      8,
      8,
      8,
      8,
      8,
      8,
      8,
      8,
      8,
      8,